{
  "$schema": "http://json-schema.org/draft-07/schema#",
  "$id": "https://core.antillanca.dev/schemas/core/frozen_release_manifest.v4.json",
  "title": "FrozenReleaseManifest.v4",
  "description": "An additive candidate inventory for the CORE v11.3.0 deterministic ContractProgram release surface.",
  "type": "object",
  "additionalProperties": false,
  "required": [
    "schema_version",
    "type",
    "release_version",
    "status",
    "scope",
    "inventory_profile",
    "critical_subsystems",
    "self_reference_policy",
    "canonicalization",
    "hash_algorithm",
    "created_at",
    "artifact_count",
    "artifacts",
    "fingerprint"
  ],
  "properties": {
    "schema_version": {"const": "core.frozen_release_manifest.v4"},
    "type": {"const": "frozen_release_manifest"},
    "release_version": {"const": "v11.3.0"},
    "status": {"const": "candidate"},
    "scope": {"const": "deterministic_contract_program_surface"},
    "inventory_profile": {"const": "core.contract_program_release.v11_3_candidate"},
    "critical_subsystems": {
      "const": ["contract_program", "executable_contracts", "release_integrity"]
    },
    "self_reference_policy": {
      "const": "manifest_file_excluded_fingerprint_covers_inventory"
    },
    "canonicalization": {"const": "core.canonical_json.v1"},
    "hash_algorithm": {"const": "sha256"},
    "created_at": {"type": "string", "format": "date-time"},
    "artifact_count": {"type": "integer", "minimum": 1},
    "artifacts": {
      "type": "array",
      "minItems": 1,
      "items": {"$ref": "#/definitions/artifact"}
    },
    "fingerprint": {"$ref": "#/definitions/fingerprint"}
  },
  "definitions": {
    "fingerprint": {
      "type": "string",
      "pattern": "^sha256:[a-f0-9]{64}$"
    },
    "artifact": {
      "type": "object",
      "additionalProperties": false,
      "required": ["path", "role", "file_sha256"],
      "properties": {
        "path": {
          "type": "string",
          "pattern": "^(?!/)(?![A-Za-z]:\\\\)(?!.*(?:^|/)\\.\\.(?:/|$)).+"
        },
        "role": {
          "enum": [
            "ci", "contract", "documentation", "example", "release_metadata",
            "runtime", "schema", "script", "test"
          ]
        },
        "file_sha256": {"$ref": "#/definitions/fingerprint"}
      }
    }
  }
}
