{
  "schema_version": "core.frozen_release_manifest.v4",
  "type": "frozen_release_manifest",
  "release_version": "v11.3.0",
  "status": "candidate",
  "scope": "deterministic_contract_program_surface",
  "inventory_profile": "core.contract_program_release.v11_3_candidate",
  "critical_subsystems": [
    "contract_program",
    "executable_contracts",
    "release_integrity"
  ],
  "self_reference_policy": "manifest_file_excluded_fingerprint_covers_inventory",
  "canonicalization": "core.canonical_json.v1",
  "hash_algorithm": "sha256",
  "created_at": "2026-08-02T21:32:00Z",
  "artifact_count": 145,
  "artifacts": [
    {
      "path": ".github/workflows/replay-certification.yml",
      "role": "ci",
      "file_sha256": "sha256:f675e541c6b842170ea83a8aad5b68014f3934cbc628193a8d00f10c8a9b1202"
    },
    {
      "path": "CHANGELOG.md",
      "role": "documentation",
      "file_sha256": "sha256:f20a6e32ed6fe08f7ae1c6c2bed64650b6256321b2e2b4ff930493c52ad6db87"
    },
    {
      "path": "README.md",
      "role": "documentation",
      "file_sha256": "sha256:995948fb5ae709bca103d631a3df269f6ea2a7832464e0b91aba22884224bf6e"
    },
    {
      "path": "contracts/CoreRuleAnchor.abi.json",
      "role": "contract",
      "file_sha256": "sha256:ee6f16b73aa75ae2d34f7925c1f08e9589be9870a1cc6c998b9c3befff953542"
    },
    {
      "path": "contracts/CoreRuleAnchor.bin",
      "role": "contract",
      "file_sha256": "sha256:c979e051176e05c75f0d6d280c0bc873b465f9403846e784d2cf3d9df7eabf0b"
    },
    {
      "path": "contracts/CoreRuleAnchor.build.json",
      "role": "contract",
      "file_sha256": "sha256:64f79b8de0896671ac0f1dcbea56b858501fb68393641d1af33feb0beb351edb"
    },
    {
      "path": "contracts/CoreRuleAnchor.runtime.bin",
      "role": "contract",
      "file_sha256": "sha256:5acb4bd825098ca7133a3867b43263bb8798659114f5bb9b945c623be30f8aae"
    },
    {
      "path": "contracts/CoreRuleAnchor.sol",
      "role": "contract",
      "file_sha256": "sha256:f56416a86f39a156a7c3b38cb4bc30a71624be43b6a7912242f6c369893d8f29"
    },
    {
      "path": "core_runtime/__version__.py",
      "role": "release_metadata",
      "file_sha256": "sha256:36a216a75a64596a8e0f7e83f231181efd9a4f842ed3cac84327c0188aa73e5b"
    },
    {
      "path": "core_runtime/cli/__init__.py",
      "role": "release_metadata",
      "file_sha256": "sha256:da4b0d5d05d13f5f1edf81328e76f9ba4abe4e7b8db062ec4d9ad6fdcdd000c8"
    },
    {
      "path": "core_runtime/core/__init__.py",
      "role": "runtime",
      "file_sha256": "sha256:8822a7991e61d2d0fe84a139b610ae7edaa60c4cee28ef714cded8062d90cf7d"
    },
    {
      "path": "core_runtime/core/canonicalization.py",
      "role": "runtime",
      "file_sha256": "sha256:d1869ce432f94dbf18e513d87f62845b9fa4ff3843a6f521782b06bf30beec83"
    },
    {
      "path": "core_runtime/core/contract_evaluator.py",
      "role": "runtime",
      "file_sha256": "sha256:8b77152dabade5b5353233b78fcaeb4e390dde2804087ccd6d0d09fe3e61ecfa"
    },
    {
      "path": "core_runtime/core/contract_executability.py",
      "role": "runtime",
      "file_sha256": "sha256:2049aa2443f7f278c19ec8b3d4918d0378bbfa4b9513fce7dcfcb69a8a43a86e"
    },
    {
      "path": "core_runtime/core/contract_loader.py",
      "role": "runtime",
      "file_sha256": "sha256:185c0e50f8d8270a845f10ca39b7e28f816e531c550d15a003681587d71037c0"
    },
    {
      "path": "core_runtime/core/contract_probes.py",
      "role": "runtime",
      "file_sha256": "sha256:e7717cda3c609a6033aa6cbca8c1f9daa582989da825cf43a290dd0b2180a5d1"
    },
    {
      "path": "core_runtime/core/contract_program.py",
      "role": "runtime",
      "file_sha256": "sha256:653a4f0a835530cd482b5e25d3f044c3395e97f6c8872c19e2d369f157cc3041"
    },
    {
      "path": "core_runtime/core/rule_anchor.py",
      "role": "runtime",
      "file_sha256": "sha256:7bf68afe068641fb522c9e00aa8180d04fcc854805fdcf2242719502046fc4f1"
    },
    {
      "path": "core_runtime/tooling/file_inventory.py",
      "role": "runtime",
      "file_sha256": "sha256:5832820749f1e0ace1d98bd98d23e63e1c31c4333039ee8d06c4b5fdaa317ebc"
    },
    {
      "path": "docs/CORE_RELEASE_README.md",
      "role": "documentation",
      "file_sha256": "sha256:f43feccc0ec48f59bd3c7ee068a0d0263e30671489ec109d8889d72c65812437"
    },
    {
      "path": "docs/EXECUTABLE_CONTRACTS_AND_PHYSICAL_SAFETY.md",
      "role": "documentation",
      "file_sha256": "sha256:37dd88604aa362e7be0995ae1fbc98dcfca490e105435047c3d02e96cc9ab8de"
    },
    {
      "path": "docs/FROZEN_RULE_ANCHORING.md",
      "role": "documentation",
      "file_sha256": "sha256:7f3e37f72b9b6c1c0099a152928477c02952612f35341258ccb65c9855439f55"
    },
    {
      "path": "docs/PROJECTION_AND_RESPONSIBLE_AGENCY.md",
      "role": "documentation",
      "file_sha256": "sha256:3ef3f54b29e4938022d10dca8f4e1916ca69557ce5eb45e70bf74d9dcd1d4d93"
    },
    {
      "path": "docs/REPRODUCIBILITY.md",
      "role": "documentation",
      "file_sha256": "sha256:e62bd5e70d527c22651cfe1ccc9fac408f323c6782c4d03d96a54e970942bc29"
    },
    {
      "path": "docs/VERSIONING_POLICY.md",
      "role": "documentation",
      "file_sha256": "sha256:ea676b9538b8c8fbf6364f9d413df3f3369d93b19cdd32da5e5bb9b01ab0e3f2"
    },
    {
      "path": "docs/releases/README.md",
      "role": "documentation",
      "file_sha256": "sha256:e91c395bf9cb469fd922250913d4b15c24a3707e894cee6d0a9317e24d501119"
    },
    {
      "path": "docs/releases/v11.1.0.md",
      "role": "documentation",
      "file_sha256": "sha256:5e22abbee2872b4ab9051c574b1ab77b4e3d419f28f1aea6c446d572a7c0c9f7"
    },
    {
      "path": "docs/releases/v11.3.0-candidate.md",
      "role": "documentation",
      "file_sha256": "sha256:54359604dd76f08915d1e1062d697de849a08e543ad0b4b5cf91747492cef025"
    },
    {
      "path": "examples/anchoring/accepted_freeze_artifact.json",
      "role": "example",
      "file_sha256": "sha256:9425bf666b56bb2602b7fe1f22af31c9b1e18937c41931fbdffd1c99ff004431"
    },
    {
      "path": "examples/anchoring/accepted_release_manifest.json",
      "role": "example",
      "file_sha256": "sha256:4bc6c300663ec5ae0397af1c43190ad6490eee0c17b1afa7da230991c11871bf"
    },
    {
      "path": "examples/anchoring/chain_adapters/arbitrum_one_valid.json",
      "role": "example",
      "file_sha256": "sha256:b0322a2ce91ee0a73cda3d68b1915d0f30c05304262de4d8bcf7e6c0ecb40021"
    },
    {
      "path": "examples/anchoring/chain_adapters/ethereum_sepolia_valid.json",
      "role": "example",
      "file_sha256": "sha256:c8e98ae2d1dc3b2b2e8f5e503d3fd6ffa553c88212347205c23da44232499a3b"
    },
    {
      "path": "examples/anchoring/chain_adapters/local_devnet_valid.json",
      "role": "example",
      "file_sha256": "sha256:0676bd552b180ae53f0e843a0c9328c3eb31f3fc92417167e101e545394d4d35"
    },
    {
      "path": "examples/anchoring/chain_adapters/polygon_mainnet_valid.json",
      "role": "example",
      "file_sha256": "sha256:64764a39b5bc7c1205b1759640647a9d2c08a25d4dcec823f36d2cf603a33a0d"
    },
    {
      "path": "examples/anchoring/chain_adapters/rejected_fingerprint_mismatch.json",
      "role": "example",
      "file_sha256": "sha256:b89c5467e65eeb42fd1bfe235722ea64a630fff7468333c99bbd4e23bd55ca33"
    },
    {
      "path": "examples/anchoring/chain_adapters/rejected_local_rpc_mainnet.json",
      "role": "example",
      "file_sha256": "sha256:cd551053a8f377fa9544a92123fcfbd078a91861f06993c2c9878ab95f2ccdd4"
    },
    {
      "path": "examples/anchoring/chain_adapters/rejected_mainnet_low_confirmations.json",
      "role": "example",
      "file_sha256": "sha256:1d9b78064733a26556b7d6dcbd305e4d056313a2c118892ae8430013484dadc7"
    },
    {
      "path": "examples/anchoring/chain_adapters/rejected_unsupported_family.json",
      "role": "example",
      "file_sha256": "sha256:a6c49e177a85d5c08bb30ad104aae99b67d0c62691c77496a029dc39b24a73e9"
    },
    {
      "path": "examples/anchoring/rejected_hash_mismatch.json",
      "role": "example",
      "file_sha256": "sha256:3daed04e153a4d932515fa857abc02b90f1648c0c40d0cc5a6af7e2848611390"
    },
    {
      "path": "examples/anchoring/rejected_not_frozen.json",
      "role": "example",
      "file_sha256": "sha256:9f9920d061e4cc92a359950643ba6aa92da7329be9afb40525805819a70fa31c"
    },
    {
      "path": "examples/anchoring/rejected_private_data.json",
      "role": "example",
      "file_sha256": "sha256:c42890915d4e8d74d9980d3134a05db6ac80ef5d3ef274e1f6690446c95f948a"
    },
    {
      "path": "examples/anchoring_event/README.md",
      "role": "documentation",
      "file_sha256": "sha256:ca65c441bfd9eb84b0d8af5b2dfc60bf64773a6751e50c757aa9dea73a463375"
    },
    {
      "path": "examples/anchoring_event/accepted_freeze_anchor.json",
      "role": "example",
      "file_sha256": "sha256:cf6167c3812df4aa4a10f4f001667e5184cbbc5819f8b18696c6ae6512695ac1"
    },
    {
      "path": "examples/anchoring_event/accepted_profile_anchor.json",
      "role": "example",
      "file_sha256": "sha256:2b3437d4055ccdaf53f8649c336ed5997a046525d8378ddcf55de617a7a220a1"
    },
    {
      "path": "examples/anchoring_event/rejected_fingerprint_mismatch.json",
      "role": "example",
      "file_sha256": "sha256:0c38bec82473d651aa0fbd83aaf1d30c589568c8974720e4e9a2e8997af1702d"
    },
    {
      "path": "examples/anchoring_event/rejected_hash_fp_mismatch.json",
      "role": "example",
      "file_sha256": "sha256:8b070d5924124cbd40315a06720c59df43c193bf2b69a3075f07e11e3df212f1"
    },
    {
      "path": "examples/anchoring_event/rejected_unknown_chain.json",
      "role": "example",
      "file_sha256": "sha256:a611c8cfa69146765534990e990252d2015f5bc43a0c6ead0e7230a52ee90fc0"
    },
    {
      "path": "examples/core_contracts/causal_trace.v1.json",
      "role": "example",
      "file_sha256": "sha256:5db15112ede884610b0784ce32d1932eb43738665967c3620aceafe9c9310127"
    },
    {